{"type":"config","name":"pii-redact pipeline performance optimization","metricName":"text_4KB_ns_op","metricUnit":"ns","bestDirection":"lower"}
{"run":1,"commit":"34eec2d","metric":701273,"metrics":{"text_clean_ns_op":493623,"text_64KB_ns_op":15088152,"cmd_simple_ns_op":40834,"json_1KB_ns_op":36838,"text_4KB_allocs":70533,"text_4KB_bytes":474,"text_orig_ns_op":696719},"status":"keep","description":"Baseline benchmark run with complex scenarios across text sizes, commands, and JSON walker.","timestamp":1777742331838,"segment":0,"confidence":null,"asi":{"hypothesis":"Baseline measurement. Primary target: 4KB text pipeline (~701µs/op). Clean text (~494µs/op) reveals regex overhead is dominant even with zero matches."}}
{"run":2,"commit":"34eec2d","metric":678066,"metrics":{"cmd_simple_ns_op":37243,"json_1KB_ns_op":36472,"text_4KB_allocs":70500,"text_4KB_bytes":474,"text_64KB_ns_op":14220889,"text_clean_ns_op":194973,"text_orig_ns_op":597186},"status":"keep","description":"Add probe-based fast paths to scanFreeText and scanKnownTokens, plus entropy fast-path. Clean text 60% faster; 4KB text 3% faster.","timestamp":1777742773578,"segment":0,"confidence":null,"asi":{"hypothesis":"Pre-filter regex layers with cheap substring/digit probes to avoid regex backtracking on inputs with no candidates. Biggest win on clean text where no patterns match.","next_action_hint":"Focus on reducing per-layer string allocations and optimizing scanKnownTokens which is still ~20% of runtime on PII-rich inputs."}}
{"run":3,"commit":"34eec2d","metric":656782,"metrics":{"cmd_simple_ns_op":36451,"json_1KB_ns_op":36124,"text_4KB_allocs":70473,"text_4KB_bytes":474,"text_64KB_ns_op":14110458,"text_clean_ns_op":193330,"text_orig_ns_op":589348},"status":"keep","description":"Skip sort.Slice for 0-1 intervals and fast-path applyIntervals for single interval.","timestamp":1777742947318,"segment":0,"confidence":2.090349558353693,"asi":{"hypothesis":"Avoid sort.Slice and strings.Builder overhead for common case of 0-1 matches per layer.","next_action_hint":"Profile PII-rich input to find next bottleneck. Consider reducing string copies between layers or optimizing scanKnownTokens regex ordering."}}
{"run":4,"commit":"34eec2d","metric":630632,"metrics":{"cmd_simple_ns_op":35465,"json_1KB_ns_op":35010,"text_4KB_allocs":115156,"text_4KB_bytes":544,"text_64KB_ns_op":13310627,"text_clean_ns_op":188089,"text_orig_ns_op":542679},"status":"discard","description":"Single-pass interval collection for KindText. Slight speedup but 69% more allocations because all layers scan original input, finding more matches that later get discarded.","timestamp":1777744636352,"segment":0,"confidence":2,"asi":{"hypothesis":"Collect intervals from all text layers on original input and apply once to avoid intermediate string copies.","next_action_hint":"Try a hybrid: run Layer 0+1 sequentially, then combine Layers 3+4 on the same string. Or focus on reducing per-match allocations in existing scanners.","rollback_reason":"Allocation regression: 115k allocs/op vs 68k baseline. All layers scanning original input find ~2x more matches that get discarded by overlap resolution. Net speedup is small (1.2%) and doesn't justify the GC pressure."}}
{"run":5,"commit":"34eec2d","metric":630377,"metrics":{"cmd_simple_ns_op":35308,"json_1KB_ns_op":35017,"text_4KB_allocs":89068,"text_4KB_bytes":565,"text_64KB_ns_op":13605645,"text_clean_ns_op":189997,"text_orig_ns_op":582651},"status":"discard","description":"Combine Layers 3+4 into single pass. Small speedup (1.2%) but 30% more allocations because entropy layer scans pre-free-text-redacted text, finding extra overlapping matches that get discarded.","timestamp":1777744920151,"segment":0,"confidence":1.701376673040153,"asi":{"hypothesis":"Combine free-text and entropy layers into single pass to avoid one string copy.","next_action_hint":"Focus on reducing regex engine load: remove redundant patterns, optimize expensive regexes, or batch candidate discovery.","rollback_reason":"30% allocation increase. scanEntropy on pre-redacted text finds extra matches that overlap with free-text matches and get discarded by applyIntervals."}}
{"run":6,"commit":"34eec2d","metric":635860,"metrics":{"cmd_simple_ns_op":34360,"json_1KB_ns_op":35773,"text_4KB_allocs":79309,"text_4KB_bytes":446,"text_64KB_ns_op":13411847,"text_clean_ns_op":189991,"text_orig_ns_op":584837},"status":"keep","description":"Re-apply pre-sizing for interval slices + hand-rolled JWT scanner. Marginal 4KB improvement (~0.3%) but command benchmark improved 5.7%. Keep as stepping stone for further regex optimizations.","timestamp":1777745357153,"segment":0,"confidence":4.135744317642968,"asi":{"hypothesis":"Hand-rolled JWT scanner + pre-sized slices. JWT scanner saves regex backtracking but slice pre-sizing hurt low-match cases. Overall small win.","next_action_hint":"Split long alternation patterns (especially aws_access_key) into separate probed patterns to reduce regex engine work."}}
{"run":7,"commit":"34eec2d","metric":593050,"metrics":{"cmd_simple_ns_op":32860,"json_1KB_ns_op":35678,"text_4KB_allocs":50470,"text_4KB_bytes":249,"text_64KB_ns_op":11162476,"text_clean_ns_op":191029,"text_orig_ns_op":537704},"status":"keep","description":"Replace regex-based entropy scanner with hand-rolled linear scanner. Eliminates regexp backtracker allocations and CPU overhead for token matching.","timestamp":1777745716571,"segment":0,"confidence":5.17268903546506,"asi":{"hypothesis":"Hand-rolled entropy scanner avoids regex engine overhead (backtracking + slice allocations) by walking token runs directly.","next_action_hint":"Look for other regex layers that can be hand-rolled: credit_card in scanFreeText, or scanKnownTokens patterns with complex backtracking."}}
{"run":8,"commit":"34eec2d","metric":526741,"metrics":{"text_clean_ns_op":189120,"text_64KB_ns_op":10290908,"cmd_simple_ns_op":32502,"json_1KB_ns_op":35472,"text_4KB_allocs":52263,"text_4KB_bytes":259,"text_orig_ns_op":464563},"status":"keep","description":"Replace credit card regex with hand-rolled scanner that walks digit sequences and validates Luhn directly. Avoids regex backtracking on complex quantified pattern.","timestamp":1777746123130,"segment":0,"confidence":5.477060189543714,"asi":{"hypothesis":"Hand-rolled credit card scanner avoids regex backtracking on `(?:\\d[ \\-]?){12,18}\\d` which was a major CPU and allocation source in scanFreeText.","next_action_hint":"Run fresh CPU profile to identify next bottleneck. Likely scanKnownTokens (50% before) or remaining scanFreeText regexes (iban, ipv4)."}}
{"run":9,"commit":"34eec2d","metric":482220,"metrics":{"cmd_simple_ns_op":30765,"json_1KB_ns_op":35766,"text_4KB_allocs":52253,"text_4KB_bytes":259,"text_64KB_ns_op":9577195,"text_clean_ns_op":122866,"text_orig_ns_op":417367},"status":"keep","description":"Add probes for discord_bot_token and asana_pat to skip expensive regexes on inputs without candidates.","timestamp":1777746398010,"segment":0,"confidence":5.828667979351818,"asi":{"hypothesis":"discord_bot_token and asana_pat had no probes, so their expensive regexes ran on every input. Adding simple substring/digit probes skips them on most inputs.","next_action_hint":"Continue hand-rolling expensive regexes in scanKnownTokens (uri_credentials) and scanFreeText (ipv4_public). Run fresh CPU profile."}}
{"run":10,"commit":"34eec2d","metric":417373,"metrics":{"cmd_simple_ns_op":27380,"json_1KB_ns_op":37266,"text_4KB_allocs":51685,"text_4KB_bytes":250,"text_64KB_ns_op":7747667,"text_clean_ns_op":122806,"text_orig_ns_op":336622},"status":"keep","description":"Remove uri_credentials regex from scanKnownTokens because findConnURIs in Layer 0 already handles the same shape with a faster hand-rolled scanner.","timestamp":1777746611254,"segment":0,"confidence":6.678742824880023,"asi":{"hypothesis":"uri_credentials regex was a redundant safety net that almost never matched (findConnURIs caught everything first). Removing it saves an expensive regex scan on every input with :// and @.","next_action_hint":"Hand-roll scanFormats multiline regexes (dotenv_pair, yaml_pair, http_header) which are expensive due to line-start anchors and long alternations."}}
{"run":11,"commit":"34eec2d","metric":339476,"metrics":{"cmd_simple_ns_op":24759,"json_1KB_ns_op":37914,"text_4KB_allocs":51551,"text_4KB_bytes":250,"text_64KB_ns_op":6615459,"text_clean_ns_op":42183,"text_orig_ns_op":260190},"status":"keep","description":"Hand-roll scanFormats multiline regexes (dotenv, yaml, http_header) into line-by-line string scanners. Eliminates expensive regex backtracking on line-start anchors.","timestamp":1777746819473,"segment":0,"confidence":7.586592295917297,"asi":{"hypothesis":"Multiline regexes with (?mi)^ anchors scan every byte looking for line starts. Hand-rolling into line-by-line scanners using strings.IndexByte and simple prefix checks is dramatically faster.","next_action_hint":"Run fresh CPU profile. scanKnownTokens (~35%) and scanFreeText (~27%) are likely the next targets. Consider hand-rolling more patterns."}}
